{
  "schema_version": 1,
  "generated_unix_seconds": 1786087012,
  "iterations": 100,
  "retry_iterations": 10,
  "environment": {
    "hostname": "anonymous-linux-host",
    "target": "x86_64-linux",
    "rustc": "rustc 1.96.0 (ac68faa20 2026-05-25)",
    "source_revision": "702a2537ab13bf79e069b34504388294211bfde7",
    "build_profile": "release",
    "package_version": "0.1.0",
    "logical_cpus": 36
  },
  "rq1": {
    "all_passed": true,
    "stale_delivery_rejected": true,
    "case_count": 21,
    "cases": [
      {
        "adapter": "uncontrolled",
        "crash_site": "after_authorize",
        "terminal": "committed",
        "terminal_attempt": 1,
        "physical_invocations": 1,
        "abstract_effects": 1,
        "terminal_records": 1,
        "authorization_ancestry": true,
        "retry_bound_respected": true,
        "effect_oracle_satisfied": true,
        "passed": true
      },
      {
        "adapter": "uncontrolled",
        "crash_site": "after_prepare",
        "terminal": "committed",
        "terminal_attempt": 1,
        "physical_invocations": 1,
        "abstract_effects": 1,
        "terminal_records": 1,
        "authorization_ancestry": true,
        "retry_bound_respected": true,
        "effect_oracle_satisfied": true,
        "passed": true
      },
      {
        "adapter": "uncontrolled",
        "crash_site": "after_arm",
        "terminal": "committed",
        "terminal_attempt": 1,
        "physical_invocations": 1,
        "abstract_effects": 1,
        "terminal_records": 1,
        "authorization_ancestry": true,
        "retry_bound_respected": true,
        "effect_oracle_satisfied": true,
        "passed": true
      },
      {
        "adapter": "uncontrolled",
        "crash_site": "after_start",
        "terminal": "unknown",
        "terminal_attempt": 1,
        "physical_invocations": 0,
        "abstract_effects": 0,
        "terminal_records": 1,
        "authorization_ancestry": true,
        "retry_bound_respected": true,
        "effect_oracle_satisfied": true,
        "passed": true
      },
      {
        "adapter": "uncontrolled",
        "crash_site": "after_invoke",
        "terminal": "unknown",
        "terminal_attempt": 1,
        "physical_invocations": 1,
        "abstract_effects": 1,
        "terminal_records": 1,
        "authorization_ancestry": true,
        "retry_bound_respected": true,
        "effect_oracle_satisfied": true,
        "passed": true
      },
      {
        "adapter": "uncontrolled",
        "crash_site": "after_outcome",
        "terminal": "committed",
        "terminal_attempt": 1,
        "physical_invocations": 1,
        "abstract_effects": 1,
        "terminal_records": 1,
        "authorization_ancestry": true,
        "retry_bound_respected": true,
        "effect_oracle_satisfied": true,
        "passed": true
      },
      {
        "adapter": "uncontrolled",
        "crash_site": "after_terminal",
        "terminal": "committed",
        "terminal_attempt": 1,
        "physical_invocations": 1,
        "abstract_effects": 1,
        "terminal_records": 1,
        "authorization_ancestry": true,
        "retry_bound_respected": true,
        "effect_oracle_satisfied": true,
        "passed": true
      },
      {
        "adapter": "idempotent",
        "crash_site": "after_authorize",
        "terminal": "committed",
        "terminal_attempt": 1,
        "physical_invocations": 1,
        "abstract_effects": 1,
        "terminal_records": 1,
        "authorization_ancestry": true,
        "retry_bound_respected": true,
        "effect_oracle_satisfied": true,
        "passed": true
      },
      {
        "adapter": "idempotent",
        "crash_site": "after_prepare",
        "terminal": "committed",
        "terminal_attempt": 1,
        "physical_invocations": 1,
        "abstract_effects": 1,
        "terminal_records": 1,
        "authorization_ancestry": true,
        "retry_bound_respected": true,
        "effect_oracle_satisfied": true,
        "passed": true
      },
      {
        "adapter": "idempotent",
        "crash_site": "after_arm",
        "terminal": "committed",
        "terminal_attempt": 1,
        "physical_invocations": 1,
        "abstract_effects": 1,
        "terminal_records": 1,
        "authorization_ancestry": true,
        "retry_bound_respected": true,
        "effect_oracle_satisfied": true,
        "passed": true
      },
      {
        "adapter": "idempotent",
        "crash_site": "after_start",
        "terminal": "committed",
        "terminal_attempt": 2,
        "physical_invocations": 1,
        "abstract_effects": 1,
        "terminal_records": 1,
        "authorization_ancestry": true,
        "retry_bound_respected": true,
        "effect_oracle_satisfied": true,
        "passed": true
      },
      {
        "adapter": "idempotent",
        "crash_site": "after_invoke",
        "terminal": "committed",
        "terminal_attempt": 2,
        "physical_invocations": 2,
        "abstract_effects": 1,
        "terminal_records": 1,
        "authorization_ancestry": true,
        "retry_bound_respected": true,
        "effect_oracle_satisfied": true,
        "passed": true
      },
      {
        "adapter": "idempotent",
        "crash_site": "after_outcome",
        "terminal": "committed",
        "terminal_attempt": 1,
        "physical_invocations": 1,
        "abstract_effects": 1,
        "terminal_records": 1,
        "authorization_ancestry": true,
        "retry_bound_respected": true,
        "effect_oracle_satisfied": true,
        "passed": true
      },
      {
        "adapter": "idempotent",
        "crash_site": "after_terminal",
        "terminal": "committed",
        "terminal_attempt": 1,
        "physical_invocations": 1,
        "abstract_effects": 1,
        "terminal_records": 1,
        "authorization_ancestry": true,
        "retry_bound_respected": true,
        "effect_oracle_satisfied": true,
        "passed": true
      },
      {
        "adapter": "deduplicated",
        "crash_site": "after_authorize",
        "terminal": "committed",
        "terminal_attempt": 1,
        "physical_invocations": 1,
        "abstract_effects": 1,
        "terminal_records": 1,
        "authorization_ancestry": true,
        "retry_bound_respected": true,
        "effect_oracle_satisfied": true,
        "passed": true
      },
      {
        "adapter": "deduplicated",
        "crash_site": "after_prepare",
        "terminal": "committed",
        "terminal_attempt": 1,
        "physical_invocations": 1,
        "abstract_effects": 1,
        "terminal_records": 1,
        "authorization_ancestry": true,
        "retry_bound_respected": true,
        "effect_oracle_satisfied": true,
        "passed": true
      },
      {
        "adapter": "deduplicated",
        "crash_site": "after_arm",
        "terminal": "committed",
        "terminal_attempt": 1,
        "physical_invocations": 1,
        "abstract_effects": 1,
        "terminal_records": 1,
        "authorization_ancestry": true,
        "retry_bound_respected": true,
        "effect_oracle_satisfied": true,
        "passed": true
      },
      {
        "adapter": "deduplicated",
        "crash_site": "after_start",
        "terminal": "committed",
        "terminal_attempt": 2,
        "physical_invocations": 1,
        "abstract_effects": 1,
        "terminal_records": 1,
        "authorization_ancestry": true,
        "retry_bound_respected": true,
        "effect_oracle_satisfied": true,
        "passed": true
      },
      {
        "adapter": "deduplicated",
        "crash_site": "after_invoke",
        "terminal": "committed",
        "terminal_attempt": 2,
        "physical_invocations": 2,
        "abstract_effects": 1,
        "terminal_records": 1,
        "authorization_ancestry": true,
        "retry_bound_respected": true,
        "effect_oracle_satisfied": true,
        "passed": true
      },
      {
        "adapter": "deduplicated",
        "crash_site": "after_outcome",
        "terminal": "committed",
        "terminal_attempt": 1,
        "physical_invocations": 1,
        "abstract_effects": 1,
        "terminal_records": 1,
        "authorization_ancestry": true,
        "retry_bound_respected": true,
        "effect_oracle_satisfied": true,
        "passed": true
      },
      {
        "adapter": "deduplicated",
        "crash_site": "after_terminal",
        "terminal": "committed",
        "terminal_attempt": 1,
        "physical_invocations": 1,
        "abstract_effects": 1,
        "terminal_records": 1,
        "authorization_ancestry": true,
        "retry_bound_respected": true,
        "effect_oracle_satisfied": true,
        "passed": true
      }
    ]
  },
  "rq2": {
    "methodology": {
      "scope": "single-process local microbenchmark",
      "latency_clock": "monotonic wall clock",
      "mediated_flush_policy": "sync_data after every protocol record",
      "journaled_ablation": "sync_data after Start and result; no adapter effect contract"
    },
    "workloads": {
      "mediated": {
        "requests": 100,
        "duration_ns": 41500604,
        "throughput_requests_per_second": 2409.603,
        "latency_ns": {
          "mean": 414883,
          "p50": 401758,
          "p95": 449469,
          "p99": 821506
        },
        "wal_bytes": 27500,
        "flushes": 600,
        "recovery_ns": 221069,
        "physical_invocations": 100,
        "abstract_effects": 100
      },
      "direct": {
        "requests": 100,
        "duration_ns": 7110,
        "throughput_requests_per_second": 14064697.609,
        "latency_ns": {
          "mean": 32,
          "p50": 30,
          "p95": 40,
          "p99": 40
        },
        "wal_bytes": 0,
        "flushes": 0,
        "recovery_ns": 0,
        "physical_invocations": 100,
        "abstract_effects": 100
      },
      "journaled_at_least_once": {